"id","NumRisk","NumTool","numSituation","numSituationGroup","name"
331,300,229,161,19,"Participation aux réunions de coordination
Partage des plannings d'exécution
Respect des balisages des zones de travail
Signature d'une convention de mise à disposition de grue ou d'échaufaudage en cas de prêt
Connaissance des PPSPS des autres entreprises intervenants pour la partie risques ""exportés""
Respect des préconisations des autres entreprises"
332,301,230,162,19,"Respect des balisages et zones de travail
Respect des zones d'évolution des engins
Port des EPI obligatoires"
333,302,231,163,19,"Respect des balisages et zones de travail
Respect des zones d'évolution des engins
Respect du plan de circulation du chantier et des règles de sécurité liées à la conduite d'engins (vitesse, signalisation) "
334,303,232,164,19,"Respect du balisage de la zone de levage
Ne pas rester dans la zone d'évolution et de manoeuvre de la charge
Port des EPI obligatoires"
335,304,233,165,19,"Respect du balisage de la zone de travail
Port des EPI obligatoires"
336,305,234,166,19,"Balisage, signalisation temporaire horizontale et verticale en amont et aval du chantier
Mise en sécurité des zones de travail
Travaux et circulation à l'intérieur de la zone balisée et signalée
Port OBLIGATOIRE des vêtements Haute Visibilité  (classe II ou III)"
337,306,235,167,19,"Respecter les consignes SNCF, la signalitique des feux Attendre levée des barrières"
338,307,236,167,19,"Les engins à chenille ne traversent pas les voies, respecter les consignes SNCF"
339,308,237,168,19,"Dépôt du dossier de DICT ou demande de plan de réseau en site privé
Demande de consignation de ligne
Isolation des conducteurs électriques et inspection complémentaire si besoin
Personnel formé et habilité"
340,309,238,168,19,"Réseau > 50000 V, respect de la distance de sécurité de 5m (3m si réseau < 50000V), mise en place d'un gabarit au niveau des zones de passage"
341,310,239,168,19,"Mise en place d'un étaiement en fouille à proximité des poteaux"
342,311,240,169,19,"Respect des DT et réalisation des dossiers DICT
Marquage et piquetage du chantier réalisé avant intervention et entretenu pendant la durée de chantier
Adaptation des techniques de terrassement : mécanique puis manuel à l'approche des réseaux
Personnel formé et habilité aux interventions à proximité des réseaux"
343,312,240,169,19,"Maîtrise de la règle des 4A : Arrêter - Alerter les pompiers et l'exploitant - Aménager le périmètre de sécurité- Accueillir les services compétents"
344,313,241,170,19,"Avoir du matériel ATEX
Ne pas effectuer de travail à point chaud"
345,314,242,171,19,"Port d'EPI couvrants (gants, manches longues, pantalon, chaussures montantes, lunettes de sécurité)
Lavage des mains systématique
Tenue des vaccins à jour"
346,315,243,171,19,"Manipulation avec des gants
Bennes dédiées sur chantier"
347,316,244,171,19,"Controle du taux d'hydrogène sulfureux
Ventilation naturelle
Port du masque filtrant et des EPI couvrants
Maintien du contact avec une personne située en dehors de la zone à risques"
348,317,245,172,19,"Baliser la zone de travail
Respecter les distances de sécurité"
349,318,246,173,19,"Balisage autour de la zone d'excavation
Respect des distances de sécurité"
350,319,246,173,19,"Balisage de la zone d'évolution de la machine
Interdiction d'accès à toute personne non autorisée ou non nécessaire
Port des EPI obligatoires"
351,320,246,173,19,"Port de protections auditives à proximité de la machine"
352,321,247,174,19,"Balisage autour de la zone d'excavation
Respect des distances de sécurité"
353,322,248,175,19,"Balisage de la zone d'évolution de la machine
Interdiction d'accès à toute personne non autorisée ou non nécessaire
Port des EPI obligatoires"
354,323,248,175,19,"Port des protections auditives"
355,324,249,176,19,"Demander les résultats des mesures libératoires
Respecter la zone de travaux de désamiantage en cas d'intervention à proximité
Consulter le DTA"
356,325,250,177,19,"Sensibilisation du personnel aux différentes situations suceptibles de contenir de l'amiante
Retrait du chantier et information du Maître d'ouvrage"
